http://purl.obolibrary.org/obo/DOID_845,cyclothymic disorder,Affective personality disorder|Cyclothymia|Cycloid personality|Cyclothymic personality,"A bipolar disorder that involves recurrent hypomanic and dysthymic episodes, but no full manic episodes or full major depressive episodes.",false,,,http://purl.obolibrary.org/obo/DOID_3312,,,,,,,,,,,,,SNOMEDCT_2010_1_31:268756002|SNOMEDCT_2010_1_31:191752001|SNOMEDCT_2010_1_31:386798001|ICD9CM:301.10|SNOMEDCT_2010_1_31:191754000|SNOMEDCT_2010_1_31:14697007|UMLS_CUI:C0010598|ICD9CM:301.1|SNOMEDCT_2010_1_31:191755004|SNOMEDCT_2010_1_31:191751008|SNOMEDCT_2010_1_31:286737005|SNOMEDCT_2010_1_31:76105009|ICD9CM:301.13|MSH:D003527|SNOMEDCT_2010_1_31:192383002,,"A bipolar disorder that involves recurrent hypomanic and dysthymic episodes, but no full manic episodes or full major depressive episodes.",,,,,,,,,,,,,,,,,,,,,,,,,,,,,,,Affective personality disorder|Cyclothymia|Cycloid personality|Cyclothymic personality,,,,disease_ontology,,,,,,,,,,,,,,,,,,,,,,,,,,,,,,,,,,,,,,DOID:845,,,,cyclothymic disorder,,,,DOID:845,,,,,,,,,,,,,,,,,,,,,,,,,,,,,,,,,,,,,,,,,,,,,
http://purl.obolibrary.org/obo/DOID_8927,learning disability,Academic skill disorder|learning disorder,"A specific developmental disorder that involves difficulty in scholastic skills such as reading, writing, spelling, reasoning, recalling and/or organizing information resulting from the brain's inability to receive and process information.",false,,,http://purl.obolibrary.org/obo/DOID_0060038,,,,,,,,,,,,,UMLS_CUI:C0023186|SNOMEDCT_2010_1_31:247576004|MSH:D007859|SNOMEDCT_2010_1_31:154974005|SNOMEDCT_2010_1_31:192531005|SNOMEDCT_2010_1_31:154973004|UMLS_CUI:C0751265|SNOMEDCT_2010_1_31:367332004|SNOMEDCT_2010_1_31:389991004|SNOMEDCT_2010_1_31:1855002,,"A specific developmental disorder that involves difficulty in scholastic skills such as reading, writing, spelling, reasoning, recalling and/or organizing information resulting from the brain's inability to receive and process information.",,,,,,,,,,,,,,,,,,,,,,,,,,,,,,DOID:2847,Academic skill disorder|learning disorder,,,,disease_ontology,,,,,,,,,,,,,,,,,,,,,,,,,,,,,,,,,,,,,,DOID:8927,,,,learning disability,,,,DOID:8927,,,,,,,,,,,,,,,,,,,,,,,,,,,,,,,,,,,,,,,,,,,,,
http://purl.obolibrary.org/obo/BFO_0000030,object,,,false,,,http://purl.obolibrary.org/obo/BFO_0000040,,,Object,object,,,,,,,,,,,,,,,,"BFO 2 Reference: Each object is such that there are entities of which we can assert unproblematically that they lie in its interior, and other entities of which we can assert unproblematically that they lie in its exterior. This may not be so for entities lying at or near the boundary between the interior and exterior. This means that two objects – for example the two cells depicted in Figure 3 – may be such that there are material entities crossing their boundaries which belong determinately to neither cell. Something similar obtains in certain cases of conjoined twins (see below).|BFO 2 Reference: ‘objects’ are sometimes referred to as ‘grains’ [74|BFO 2 Reference: an object is a maximal causally unified material entity|BFO 2 Reference: To say that b is causally unified means: b is a material entity which is such that its material parts are tied together in such a way that, in environments typical for entities of the type in question,if c, a continuant part of b that is in the interior of b at t, is larger than a certain threshold size (which will be determined differently from case to case, depending on factors such as porosity of external cover) and is moved in space to be at t at a location on the exterior of the spatial region that had been occupied by b at t, then either b’s other parts will be moved in coordinated fashion or b will be damaged (be affected, for example, by breakage or tearing) in the interval between t and t.causal changes in one part of b can have consequences for other parts of b without the mediation of any entity that lies on the exterior of b. Material entities with no proper material parts would satisfy these conditions trivially. Candidate examples of types of causal unity for material entities of more complex sorts are as follows (this is not intended to be an exhaustive list):CU1: Causal unity via physical coveringHere the parts in the interior of the unified entity are combined together causally through a common membrane or other physical covering. The latter points outwards toward and may serve a protective function in relation to what lies on the exterior of the entity [13, 47|BFO 2 Reference: BFO rests on the presupposition that at multiple micro-, meso- and macroscopic scales reality exhibits certain stable, spatially separated or separable material units, combined or combinable into aggregates of various sorts (for example organisms into what are called ‘populations’). Such units play a central role in almost all domains of natural science from particle physics to cosmology. Many scientific laws govern the units in question, employing general terms (such as ‘molecule’ or ‘planet’) referring to the types and subtypes of units, and also to the types and subtypes of the processes through which such units develop and interact. The division of reality into such natural units is at the heart of biological science, as also is the fact that these units may form higher-level units (as cells form multicellular organisms) and that they may also form aggregates of units, for example as cells form portions of tissue and organs form families, herds, breeds, species, and so on. At the same time, the division of certain portions of reality into engineered units (manufactured artifacts) is the basis of modern industrial technology, which rests on the distributed mass production of engineered parts through division of labor and on their assembly into larger, compound units such as cars and laptops. The division of portions of reality into units is one starting point for the phenomenon of counting.",,b is an object means: b is a material entity which manifests causal unity of one or other of the types CUn listed above & is of a type (a material universal) instances of which are maximal relative to this criterion of causal unity. (axiom label in BFO2 Reference: [024-001]),organism|grain of sand|cell|cells and organisms|solid portions of matter|planet|atom|molecule|star|engineered artifacts|organelle,,,,,,,,,,,,,,,,,,,,,,,,,,,,,,,,,,,BFO:0000030,,,,,,,,,,,,,,,,,,,,,,,,,,,,,,,,,http://purl.obolibrary.org/obo/bfo.owl,object,,,,,,,,,,,,,,,,,,,,,,,,,,,,,,,,,,,,,,,,,,,,,,,,,
http://purl.obolibrary.org/obo/GO_0044640,"envenomation resulting in negative regulation of complement activation, lectin pathway in other organism",,"A process that begins with venom being forced into an organism by the bite or sting of another organism, and ends with the resultant negative regulation of complement activation via the lectin pathway in the bitten/stung organism.",false,,,http://purl.obolibrary.org/obo/GO_0044639,,,,,,,,,,,,,,,"A process that begins with venom being forced into an organism by the bite or sting of another organism, and ends with the resultant negative regulation of complement activation via the lectin pathway in the bitten/stung organism.",,,,,,,,,,,,,,,,,,,,,,,,,,,,,,,,,,,,,,,,,,,GO:0044640,,,,,,,,,,,,,,,,,,,,,,,,,,,,,,,,,,"envenomation resulting in negative regulation of complement activation, lectin pathway in other organism",,,,,,,,,,http://purl.obolibrary.org/obo/go.owl,,,,,,,,,,,,,,,,,,,,,,,,,,,,,,,,,,,,,,,
http://purl.obolibrary.org/obo/DOID_603,AIDS phobia,,,false,,,http://purl.obolibrary.org/obo/DOID_0060048,,,,,,,,,,,,,NCI:C35614|UMLS_CUI:C0853870,,,,,,,,,,,,,,,,,,,,,,,,,,,,,,,,,,,,,disease_ontology,,,,,,,,,,,,,,,,,,,,,,,,,,,,,,,,,,,,,,DOID:603,,,,AIDS phobia,,,,DOID:603,,,,,,,,,,,,,,,,,,,,,,,,,,,,,,,,,,,,,,,,,,,,,
http://purl.obolibrary.org/obo/DOID_4540,dysgraphia,,"A writing disorder that involves a deficiency in the ability to write where the writing is distorted or incorrect, spelling difficulty, poor handwriting or trouble putting thoughts on paper.",false,,,http://purl.obolibrary.org/obo/DOID_0060047,,,,,,,,,,,,,SNOMEDCT_2010_1_31:206990000|SNOMEDCT_2010_1_31:27206009|MSH:D000381|SNOMEDCT_2010_1_31:158321001|UMLS_CUI:C0001825,,"A writing disorder that involves a deficiency in the ability to write where the writing is distorted or incorrect, spelling difficulty, poor handwriting or trouble putting thoughts on paper.",,,,,,,,,,,,,,,,,,,,,,,,,,,,,,,,,,,disease_ontology,,,,,,,,,,,,,,,,,,,,,,,,,,,,,,,,,,,,,,DOID:4540,,,,dysgraphia,,,,DOID:4540,,,,,,,,,,,,,,,,,,,,,,,,,,,,,,,,,,,,,,,,,,,,,
http://purl.obolibrary.org/obo/OGMS_0000024,DEPRECATED sign,,The class sign has been replaced by three seperate classes which reflect the different types of signs possible.,true,,,,,,,,,,,,,,,,,,,,,,,,,,,,,,,,,,,,,,,,,,,,,,,,,,,,,,,,,,,,,OGMS:0000024,,,,,,,,,,,,,,,,,,,,,,,,,,,,,,,,The class sign has been replaced by three seperate classes which reflect the different types of signs possible.,,DEPRECATED sign,http://ogms.googlecode.com/svn/trunk/src/ontology/ogms.owl,true,,,,,,,,,,,,,,,,,,,,,,,,,,,,,,,,,,,,,,,,,,,,,,,
http://purl.obolibrary.org/obo/OGMS_0000134,cancer progression stage,,,false,,,http://purl.obolibrary.org/obo/OGMS_0000133,,,,,,,,,,,,,,,,,,,,,,,,,,,,,,,,,,,,,,,,,,,,,,,,,,,,,,,,,,OGMS:0000134,,,,,,,,,,,,,,,,,,,,,,,,,,,,,,,,,,cancer progression stage,,,,,,,,,,,,,,,,,,,,,,,,,,,,,,,,,,,,,,,,,,,,,,,,,
http://purl.obolibrary.org/obo/OGMS_0000117,asymptomatic,,A disease stage characterized by the lack of symptoms associated with a given disease,false,,,http://purl.obolibrary.org/obo/ogms.owl#disease_stage,,,,,,,,,,,,creation date: 2018-11-27,,,A disease stage characterized by the lack of symptoms associated with a given disease,,,,,,,,,,,,,,,,,,,,,,,,,,,,,,,,,,,,,,,,,,,OGMS:0000117,,,,,,,,,,,,,,,,,,,,,,,,,,,,,,,,,,asymptomatic,,,,,,,,,,,,,,,,,,,,,,,,,,,,,,,,,,,,,,,,,,,,,,,,,
http://purl.obolibrary.org/obo/MF_0000070,a memory,,"A memory is a mental disposition that is realized in a process of remembering, i.e. a memory of X is a disposition realized in the process of remembering X.",false,,,http://purl.obolibrary.org/obo/MF_0000033,,,,,,,,,,,,,,,"A memory is a mental disposition that is realized in a process of remembering, i.e. a memory of X is a disposition realized in the process of remembering X.",,,,,,,,,,,,,,,,,,,,,,,,,,,,,,,,,,,,,,,,,,,MF:0000070,,,,,,,,,,,,,,,,,,,,,,,,,,,,,,,,,,a memory,,,,,,,,,,,,,,,,,,,,,,,,,,,,,,,,,,,,,,,,,,,,,,,,,
http://purl.obolibrary.org/obo/DOID_0060037,developmental disorder of mental health,,A disease of mental health that occur during a child's developmental period between birth and age 18 resulting in retarding of the child's psycholotgical or physical development.,false,,,http://purl.obolibrary.org/obo/MFOMD_0000004,,,,,,,,,,,,,,,A disease of mental health that occur during a child's developmental period between birth and age 18 resulting in retarding of the child's psycholotgical or physical development.,,,,,,,,,,,,,,,,,,,,,,,,,,,,,,,,,,,disease_ontology,,,,,,,,,,,,,,,,,,,,,,,,,,,,,,,,,,,,,,DOID:0060037,,,,developmental disorder of mental health,,,,DOID:0060037,,,,,,,,,,,,,,,,,,,,,,,,,,,,,,,,,,,,,,,,,,,,,
http://purl.obolibrary.org/obo/GO_0002124,territorial aggressive behavior,,"Aggressive behavior performed in defence of a fixed area against intruders, typically conspecifics.",false,,,http://purl.obolibrary.org/obo/GO_0002118,,,,,,,,,,,,,,,"Aggressive behavior performed in defence of a fixed area against intruders, typically conspecifics.",,,,,,,,,,,,,,,,,,,,,,,,,,,,,,,,,,,,,,,,,,,GO:0002124,,,,,,,,,,,,,,,,,,,,,,,,,,,,,,,,,,territorial aggressive behavior,,,,,,,,,,http://purl.obolibrary.org/obo/go.owl,,,,,,,,,,,,,,,,,,,,,,,,,,,,,,,,,,,,,,,
http://purl.obolibrary.org/obo/DOID_0060164,pain disorder,,"A somatoform disorder that involves chronic pain in one or more areas, and is thought to be caused by psychological stress.|A somatoform disorder characterized by a chief complaint of severe chronic pain which is neither feigned nor intentionally produced, but in which psychological factors appear to play a major role in onset, severity, exacerbation, or maintenance.

|
The pain cannot be fully attributed to a known medical disorder, and causes clinically significant distress, impairment, or both in social, academic, occupational, or other areas of functioning.

Psychological factors are judged to play an important role in the onset, severity, exacerbation, or maintenance of the pain and the pain is not intentionally produced or better accounted for by a mood disorder, anxiety disorder, or psychotic disorder.

http://emedicine.medscape.com/article/914594-overview

In most cases the pain has persisted for many years by the time the individual comes to the attention of the mental health profession. Important factors that appear to influence recovery from pain disorder are the individual's acknowledgment of pain.

DSM-IV-TR (american Psychiatric Association)",false,,,http://purl.obolibrary.org/obo/DOID_4737,trastorno por dolor,,,,307.89,,,,,,,,,,"A somatoform disorder that involves chronic pain in one or more areas, and is thought to be caused by psychological stress.|A somatoform disorder characterized by a chief complaint of severe chronic pain which is neither feigned nor intentionally produced, but in which psychological factors appear to play a major role in onset, severity, exacerbation, or maintenance.

",,,,,,,,,,,,,,,,,,,,,,,,,,,,,,,,,,,disease_ontology,,,,,,,,DOID:0060164,,,,,,,,,,,,,,,,,,,,,,,,,,lschriml,2011-09-07T01:42:46Z,,,DOID:0060164,,"
The pain cannot be fully attributed to a known medical disorder, and causes clinically significant distress, impairment, or both in social, academic, occupational, or other areas of functioning.

Psychological factors are judged to play an important role in the onset, severity, exacerbation, or maintenance of the pain and the pain is not intentionally produced or better accounted for by a mood disorder, anxiety disorder, or psychotic disorder.

http://emedicine.medscape.com/article/914594-overview

In most cases the pain has persisted for many years by the time the individual comes to the attention of the mental health profession. Important factors that appear to influence recovery from pain disorder are the individual's acknowledgment of pain.

DSM-IV-TR (american Psychiatric Association)",,pain disorder,,,,DOID:0060164,,,F45.4,,,,,,,,,,,,,,,,,,,,,,,,,,,,,,,,,,,,,,,,,,
http://purl.obolibrary.org/obo/DOID_0060147,semantic agnosia,,"An agnosia that is a loss of the ability to visually recognise an object while maintaining the use of non-visual sensory systems such as feeling, tapping, smelling, rocking or flicking the object to recognise the object.",false,,,http://purl.obolibrary.org/obo/DOID_4090,,,,,,,,,,,,,,,"An agnosia that is a loss of the ability to visually recognise an object while maintaining the use of non-visual sensory systems such as feeling, tapping, smelling, rocking or flicking the object to recognise the object.",,,,,,,,,,,,,,,,,,,,,,,,,,,,,,,,,,,disease_ontology,,,,,,,,,,,,,,,,,,,,,,,,,,,,,,,,,,lschriml,2011-08-22T12:04:56Z,,,DOID:0060147,,,,semantic agnosia,,,,DOID:0060147,,,,,,,,,,,,,,,,,,,,,,,,,,,,,,,,,,,,,,,,,,,,,
http://purl.obolibrary.org/obo/GO_0008343,adult feeding behavior,,Feeding behavior in a fully developed and mature organism.,false,,,http://purl.obolibrary.org/obo/GO_0007631|http://purl.obolibrary.org/obo/GO_0030534,,,,,,,,,,,,,,,Feeding behavior in a fully developed and mature organism.,,,,,,,,,,,,,,,,,,,,,,,,,,,,,,,,,,,,,,,,,,,GO:0008343,,,,,,,,,,,,,,,,,,,,,,,,,,,,,,,,,,adult feeding behavior,,,,,,,,,,http://purl.obolibrary.org/obo/go.owl,,,,,,,,,,,,,,,,,,,,,,,,,,,,,,,,,,,,,,,
http://purl.obolibrary.org/obo/MF_0000011,visual problem solving behavior,,,false,,,http://purl.obolibrary.org/obo/MF_0000071,,,,,,,,,,,,,,,,,,,,,,,,,,,,,,,,,,,,,,,,,,,,,,,,,,,,,,,,,,MF:0000011,,,,,,,,,,,,,,,,,,,,,,,,,,,,,,,,,,visual problem solving behavior,,,,,,,,,,,,,,,,,,,,,,,,,,,,,,,,,,,,,,,,,,,,,,,,,
http://purl.obolibrary.org/obo/GO_0007616,long-term memory,,"The memory process that deals with the storage, retrieval and modification of information a long time (typically weeks, months or years) after receiving that information. This type of memory is typically dependent on gene transcription regulated by second messenger activation.",false,,,http://purl.obolibrary.org/obo/GO_0007613,,,,,,,,,,,,,,,"The memory process that deals with the storage, retrieval and modification of information a long time (typically weeks, months or years) after receiving that information. This type of memory is typically dependent on gene transcription regulated by second messenger activation.",,,,,,,,,,,,,,,,,,,,,,,,,,,,,,,,,,,,,,,,,,,GO:0007616,,,,,,,,,,,,,,,,,,,,,,,,,,,,,,,,,,long-term memory,,,,,,,,,,http://purl.obolibrary.org/obo/go.owl,,,,,,,,,,,,,,,,,,,,,,,,,,,,,,,,,,,,,,,
http://purl.obolibrary.org/obo/OGMS_0000025,clinical manifestation of a disease,,A manifestation of a disease that is detectable in a clinical history taking or physical examination.,false,,,http://purl.obolibrary.org/obo/OGMS_0000022,,,,,,,,,,,,creation date: 2009-06-23T11:15:43Z,,,A manifestation of a disease that is detectable in a clinical history taking or physical examination.,http://ontology.buffalo.edu/medo/Disease_and_Diagnosis.pdf,,,,,,,,,,,,,,,,,,,,,,,,,,,,,,,,,,,,,,,,,,OGMS:0000025,,,,,,,,,,,,,,,,,,,,,,,,,,,,,,,,,,clinical manifestation of a disease,,,,,,,,,,,,,,,,,,,,,,,,,,,,,,,,,,,,,,,,,,,,,Albert Goldfain,,,,
http://purl.obolibrary.org/obo/DOID_0060045,Munchausen by proxy,,"A factitious disorder that involves a care giver's deliberate exaggeration, fabrication, and/or induce physical, psychological, behavioral, and/or mental health problems in others.",false,,,http://purl.obolibrary.org/obo/DOID_1766,,,,,,,,,,,,,,,"A factitious disorder that involves a care giver's deliberate exaggeration, fabrication, and/or induce physical, psychological, behavioral, and/or mental health problems in others.",,,,,,,,,,,,,,,,,,,,,,,,,,,,,,,,,,,disease_ontology,,,,,,,,,,,,,,,,,,,,,,,,,,,,,,,,,,,,,,DOID:0060045,,,,Munchausen by proxy,,,,DOID:0060045,,,,,,,,,,,,,,,,,,,,,,,,,,,,,,,,,,,,,,,,,,,,,
http://purl.obolibrary.org/obo/DOID_0060138,autotopagnosia,,An agnosia that is a loss of the ability to orient parts of the body.,false,,,http://purl.obolibrary.org/obo/DOID_4090,,,,,,,,,,,,,,,An agnosia that is a loss of the ability to orient parts of the body.,,,,,,,,,,,,,,,,,,,,,,,,,,,,,,,,,,,disease_ontology,,,,,,,,,,,,,,,,,,,,,,,,,,,,,,,,,,lschriml,2011-08-22T12:04:56Z,,,DOID:0060138,,,,autotopagnosia,,,,DOID:0060138,,,,,,,,,,,,,,,,,,,,,,,,,,,,,,,,,,,,,,,,,,,,,
http://purl.obolibrary.org/obo/DOID_0060155,visual agnosia,,An agnosia that is a loss of the ability to visually recognize objects.,false,,,http://purl.obolibrary.org/obo/DOID_4090,,,,,,,,,,,,,MSH:C531604,,An agnosia that is a loss of the ability to visually recognize objects.,,,,,,,,,,,,,,,,,,,,,,,,,,,,,,,,,,,disease_ontology,,,,,,,,,,,,,,,,,,,,,,,,,,,,,,,,,,lschriml,2011-08-22T12:04:56Z,,,DOID:0060155,,,,visual agnosia,,,,DOID:0060155,,,,,,,,,,,,,,,,,,,,,,,,,,,,,,,,,,,,,,,,,,,,,
http://purl.obolibrary.org/obo/BFO_0000040,material entity,,,false,,,http://purl.obolibrary.org/obo/BFO_0000004,,,MaterialEntity,material,,,,,,,,,,,,,,,,"BFO 2 Reference: ‘Matter’ is intended to encompass both mass and energy (we will address the ontological treatment of portions of energy in a later version of BFO). A portion of matter is anything that includes elementary particles among its proper or improper parts: quarks and leptons, including electrons, as the smallest particles thus far discovered; baryons (including protons and neutrons) at a higher level of granularity; atoms and molecules at still higher levels, forming the cells, organs, organisms and other material entities studied by biologists, the portions of rock studied by geologists, the fossils studied by paleontologists, and so on.Material entities are three-dimensional entities (entities extended in three spatial dimensions), as contrasted with the processes in which they participate, which are four-dimensional entities (entities extended also along the dimension of time).According to the FMA, material entities may have immaterial entities as parts – including the entities identified below as sites; for example the interior (or ‘lumen’) of your small intestine is a part of your body. BFO 2.0 embodies a decision to follow the FMA here.|BFO 2 Reference: Material entities (continuants) can preserve their identity even while gaining and losing material parts. Continuants are contrasted with occurrents, which unfold themselves in successive temporal parts or phases [60|BFO 2 Reference: Object, Fiat Object Part and Object Aggregate are not intended to be exhaustive of Material Entity. Users are invited to propose new subcategories of Material Entity.",,A material entity is an independent continuant that has some portion of matter as proper or improper continuant part. (axiom label in BFO2 Reference: [019-002]),a tornado|an energy wave|a puff of smoke|a hurricane|the undetached arm of a human being|a flame|a photon|an aggregate of human beings.|a sea wave|an epidemic|a human being|a forest fire,,,,,(forall (x) (if (and (Entity x) (exists (y t) (and (MaterialEntity y) (continuantPartOfAt x y t)))) (MaterialEntity x))) // axiom label in BFO2 CLIF: [021-002] |(forall (x) (if (and (Entity x) (exists (y t) (and (MaterialEntity y) (continuantPartOfAt y x t)))) (MaterialEntity x))) // axiom label in BFO2 CLIF: [020-002] |(forall (x) (if (MaterialEntity x) (IndependentContinuant x))) // axiom label in BFO2 CLIF: [019-002] ,Every entity which has a material entity as continuant part is a material entity. (axiom label in BFO2 Reference: [020-002])|every entity of which a material entity is continuant part is also a material entity. (axiom label in BFO2 Reference: [021-002]),,,,,,,,,,,,,,,,,,,,,,,,,,,,,BFO:0000040,,,,,,,,,,,,,,,,,,,,,,,,,,,,,,,,,http://purl.obolibrary.org/obo/bfo.owl,material entity,,,,,,,,,,,,,,,,,,,,,,,,,,,,,,,,,,,,,,,,,,,,,,,,,
http://purl.obolibrary.org/obo/NBO_0000537,circadian regulation of systemic arterial blood pressure,,"""Any process in which an organism modulates its blood pressure at different values with a regularity of approximately 24 hours."" [GO:GO:0003052]",false,,,http://purl.obolibrary.org/obo/GO_0048512,,,,,,,,,,,,,,,"""Any process in which an organism modulates its blood pressure at different values with a regularity of approximately 24 hours."" [GO:GO:0003052]",,,,,,,,,,,,,,,,,,,,,,,,,,,,,,,,,,,,,,,,,,,NBO:0000537,,,,,,,,,,,,,,,,,,,,,,,,,,,,,,,,,,circadian regulation of systemic arterial blood pressure,,,,,,,,,,http://purl.obolibrary.org/obo/nbo.owl,,,,,,,,,,,,,,,,,,,,,,,,,,,,,,,,,,,,,,,
http://purl.obolibrary.org/obo/DOID_10236,exhibitionism,,,false,,,http://purl.obolibrary.org/obo/DOID_0060044,,,,,,,,,,,,,SNOMEDCT_2010_1_31:154907002|UMLS_CUI:C0015269|SNOMEDCT_2010_1_31:268763002|SNOMEDCT_2010_1_31:192514003|ICD9CM:302.4|SNOMEDCT_2010_1_31:58349009|SNOMEDCT_2010_1_31:191781000|MSH:D005084,,,,,,,,,,,,,,,,,,,,,,,,,,,,,,,,,,,,,disease_ontology,,,,,,,,,,,,,,,,,,,,,,,,,,,,,,,,,,,,,,DOID:10236,,,,exhibitionism,,,,DOID:10236,,,,,,,,,,,,,,,,,,,,,,,,,,,,,,,,,,,,,,,,,,,,,
http://purl.obolibrary.org/obo/MF_0000071,problem solving behaviour,,,false,,,http://purl.obolibrary.org/obo/GO_0007610,,,,,,,,,,,,,,,,,,,,,,,,,,,,,,,,,,,,,,,,,,,,,,,,,,,,,,,,,,MF:0000071,,,,,,,,,,,,,,,,,,,,,,,,,,,,,,,,,,problem solving behaviour,,,,,,,,,,,,,,,,,,,,,,,,,,,,,,,,,,,,,,,,,,,,,,,,,
http://purl.obolibrary.org/obo/MF_0000032,bodily disposition,,"A bodily disposition is a disposition that inheres in some extended organism. Examples are: my disposition to catch a cold when exposed to a virus, my ability to speak the English language.",false,,,http://purl.obolibrary.org/obo/BFO_0000016,,,,,,,,,,,,,,,"A bodily disposition is a disposition that inheres in some extended organism. Examples are: my disposition to catch a cold when exposed to a virus, my ability to speak the English language.",,,,,,,,,,,,,,,,,,,,,,,,,,,,,,,,,,,,,,,,,,,MF:0000032,,,,,,,,,,,,,,,,,,,,,,,,,,,,,,,,,,bodily disposition,,,,,,,,,,,,,,,,,,,,,,,,,,,,,,,,,,,,,,,,,,,,,,,,,
http://purl.obolibrary.org/obo/BFO_0000017,realizable entity,,,false,,,http://purl.obolibrary.org/obo/BFO_0000020,,,RealizableEntity,realizable,,,,,,,,,,,,,,,,,,To say that b is a realizable entity is to say that b is a specifically dependent continuant that inheres in some independent continuant which is not a spatial region and is of a type instances of which are realized in processes of a correlated type. (axiom label in BFO2 Reference: [058-002]),the role of being a doctor|the function of your reproductive organs|the role of this boundary to delineate where Utah and Colorado meet|the disposition of this piece of metal to conduct electricity.|the disposition of your blood to coagulate,,,,,(forall (x t) (if (RealizableEntity x) (exists (y) (and (IndependentContinuant y) (not (SpatialRegion y)) (bearerOfAt y x t))))) // axiom label in BFO2 CLIF: [060-002] |(forall (x) (if (RealizableEntity x) (and (SpecificallyDependentContinuant x) (exists (y) (and (IndependentContinuant y) (not (SpatialRegion y)) (inheresIn x y)))))) // axiom label in BFO2 CLIF: [058-002] ,All realizable dependent continuants have independent continuants that are not spatial regions as their bearers. (axiom label in BFO2 Reference: [060-002]),,,,,,,,,,,,,,,,,,,,,,,,,,,,,BFO:0000017,,,,,,,,,,,,,,,,,,,,,,,,,,,,,,,,,http://purl.obolibrary.org/obo/bfo.owl,realizable entity,,,,,,,,,,,,,,,,,,,,,,,,,,,,,,,,,,,,,,,,,,,,,,,,,
